{"protocolMajor":1,"protocolMinor":3,"type":"pairRequest","serverId":"server-wire","sessionId":"android-pending","connectionId":"android-wire","sequence":0,"sentAtMs":1700000000000,"payload":{"action":"pairRequest","requestId":"request-wire","deviceId":"device-wire","deviceName":"Galaxy Tab A8","model":"SM-X200","protocolMajor":1,"protocolMinor":3}}
